{
  "artifacts": [
    {
      "path": "artifacts/scientific/scheduler-lifecycle-smoke/shim-research-scheduler-production-boundary-scheduler/literature_discover/task-shim-research-scheduler-production-boundary-scheduler-literature_discover/discover_final_shortlist_boundary.json",
      "type": "discover_final_shortlist_boundary_json"
    },
    {
      "path": "artifacts/scientific/scheduler-lifecycle-smoke/shim-research-scheduler-production-boundary-scheduler/literature_discover/task-shim-research-scheduler-production-boundary-scheduler-literature_discover/literature_discovery.json",
      "type": "solar_evidence_json"
    }
  ],
  "inputs": {
    "allow_network_fetch": false,
    "fixture_fallback": true,
    "limit": 3,
    "min_online_source_channels": 1,
    "paper_id": "paper-shim-research-scheduler-production-boundary-scheduler",
    "paper_path": "plugins/autosci/tests/fixtures/sample_paper.md",
    "query": "scheduler lifecycle smoke",
    "require_online_source_evidence": false,
    "smoke_mode": true,
    "topic": "scheduler lifecycle smoke"
  },
  "limitations": [
    "Fixture discovery uses local candidates, not live literature search.",
    "Final discovery shortlist requires non-empty candidates backed by non-fixture provider source channels."
  ],
  "node_id": "literature_discover",
  "outputs": {
    "candidates": [
      {
        "candidate_id": "candidate-autosci-fixture-paper",
        "dedup_status": "known",
        "fetch_status": "fetched",
        "ranking_rationale": "Fixture-mode candidate matches the requested Solar evidence adapter smoke test.",
        "ranking_score": 1.0,
        "source_channels": [
          "local_fixture"
        ],
        "source_ref": "plugins/autosci/tests/fixtures/sample_paper.md",
        "title": "AutoSci Adapter Fixture Paper"
      }
    ],
    "limit": 3,
    "mode": "fixture",
    "query": "scheduler lifecycle smoke",
    "source_provider_boundary": {
      "action": "discover_literature",
      "candidate_count": 1,
      "candidate_ids": [
        "candidate-autosci-fixture-paper"
      ],
      "completed": false,
      "final_shortlist_boundary": {
        "blocking_reasons": [
          "provider-backed source channel is missing",
          "no non-fixture provider source channel was present"
        ],
        "candidate_count": 1,
        "candidate_ids": [
          "candidate-autosci-fixture-paper"
        ],
        "final_shortlist_ready": false,
        "limitations": [
          "Final discovery shortlist requires non-empty candidates backed by non-fixture provider source channels."
        ],
        "mode": "fixture",
        "provider_channels": [],
        "schema": "autosci_discover_final_shortlist_boundary.v1",
        "source_provider_boundary_status": "incomplete",
        "status": "discover_shortlist_incomplete"
      },
      "generic_channels": [
        "local_fixture"
      ],
      "invalid_reasons": [
        "no non-fixture provider source channel was present"
      ],
      "limitations": [
        "Source runtime evidence did not prove a non-fixture provider channel."
      ],
      "provider_channels": [],
      "runtime_record_sources": [],
      "schema": "autosci_source_provider_boundary.v1",
      "source_channels": [
        "local_fixture"
      ],
      "status": "incomplete"
    }
  },
  "provenance": {
    "implementation_package": "plugins/autosci",
    "operator_id": "autosci-bridge",
    "timestamp": "2026-07-10T14:12:41Z"
  },
  "schema": "literature_discovery.v1",
  "sprint_id": "shim-research-scheduler-production-boundary-scheduler",
  "status": "completed",
  "task_id": "task-shim-research-scheduler-production-boundary-scheduler-literature_discover"
}
