{
  "schema": "literature_discovery.v1",
  "task_id": "f",
  "sprint_id": "f",
  "node_id": "f",
  "status": "completed",
  "inputs": {},
  "outputs": {
    "query": "f",
    "candidates": []
  },
  "artifacts": [],
  "provenance": {
    "operator_id": "f",
    "implementation_package": "f",
    "timestamp": "2026-07-10T00:00:00Z"
  },
  "limitations": []
}
